commit_or_run_id	stage	model_family	feature_lane	cv_mae	cv_mae_std	validation_mae	runtime_seconds	status	params_summary	description
20260508-221818-smoke-v5_plus_parcel_numeric	smoke	xgboost_v6	v5_plus_parcel_numeric				3600.092455	timeout	smoke_laneA_parcel_numeric_components	Smoke Lane A: v5 iter10 anchor + bounded numeric components parsed from first parcel_id (prefix code and parcel number). Train-only inspection found structured cadastral IDs; tests whether within-section parcel positioning carries signal beyond commune_first/cadastral_first cats without using raw high-cardinality IDs.
20260508-232100-smoke-v4_plus_parcel_numeric	smoke	xgboost_v6	v4_plus_parcel_numeric	48219.945730	5176.027677		1554.509488	revert	smoke_laneB_v4_parcel_numeric_components	Smoke Lane B: v4 W''''' anchor + bounded numeric components parsed from first parcel_id (prefix code and parcel number). Tests whether within-section parcel positioning adds signal to the promoted v4 recipe without using raw high-cardinality IDs.
20260508-234913-smoke-v4_plus_commune_section_cat	smoke	xgboost_v6	v4_plus_commune_section_cat	48512.356394	5012.684911		1476.221932	revert	smoke_laneC_commune_section_cat	Smoke Lane C: v4 W''''' anchor + combined commune_section categorical (commune_first + cadastral_first). Tests geo_granularity: section codes repeat across communes, so a nested combined category may preserve cadastral geography that separate native cats only approximate.
20260509-161727-deepen-v4_anchor	deepen	xgboost_v6	v4_anchor	46946.756809	5238.026248		906.669483	keep	deepen_iter1_top15_submodels	Deepen iter1: extend per-type sub-models from promoted v4 top 5 types to top 15 types, keeping n_estimators=4000 and blend=0.3. v5 top10 gave a small lift; this tests whether additional type coverage continues that direction as one architecture knob.
20260509-165753-deepen-v4_anchor	deepen	xgboost_v6	v4_anchor	46879.264159	5285.137443		891.472251	keep	deepen_iter2_top15_nest5000	Deepen iter2: on top of iter1 (top15 per-type sub-models kept), increase n_estimators from 4000 to 5000 in both global and sub-models. v5's top10+n_est5000 step improved by ~69 MAE; repeating it on top15 may beat the raw global best.
20260509-171357-deepen-v4_anchor	deepen	xgboost_v6	v4_anchor	47252.542379	3268.159541		902.138699	confirm	confirm_iter2_seed2026	Stage 4 confirm seed=2026 of iter2 (top15 per-type sub-models + n_est=5000). Verify the new raw-best recipe against the prior v4/v5 confirmation baselines before promotion.
20260509-173002-deepen-v4_anchor	deepen	xgboost_v6	v4_anchor	46653.363174	5466.566178		1080.110452	keep	deepen_iter3_top15_nest6000	Deepen iter3: on top of iter2 (top15+n_est5000), increase n_estimators from 5000 to 6000 in both global and sub-models. Tests whether the capacity ramp still has headroom after the new raw-best iter2.
20260509-174840-deepen-v4_anchor	deepen	xgboost_v6	v4_anchor	47192.529246	3177.342838		1113.442358	confirm	confirm_iter3_seed2026	Stage 4 confirm seed=2026 of iter3 (top15 per-type sub-models + n_est=6000). Verify the new raw global best before promotion.
