commit_or_run_id	stage	model_family	feature_lane	cv_mae	cv_mae_std	validation_mae	runtime_seconds	status	params_summary	description
20260509-182620-smoke-v6_plus_top20_submodels	smoke	xgboost_v7	v6_plus_top20_submodels	47216.675236	5263.901533		1046.376802	revert	smoke_laneA_top20_submodels_min100	Smoke Lane A: v6 promoted anchor + extend per-type sub-models from top15/min200 to top20/min100. Wide architecture coverage test: determine whether remaining mid-frequency property types add specialized signal before local tuning.
20260509-184448-smoke-v6_blend02	smoke	xgboost_v7	v6_blend02	46726.018134	5530.229088		1055.034175	revert	smoke_laneB_blend02	Smoke Lane B: v6 promoted anchor with submodel BLEND lowered from 0.3 to 0.2. Wide architecture-weight test: v6 gained from more type coverage, but less submodel weight may reduce variance while keeping type-specific signal.
20260509-190305-smoke-v6_nest7000	smoke	xgboost_v7	v6_nest7000	46498.555473	5582.213215		1395.082747	keep	smoke_laneC_nest7000	Smoke Lane C: v6 promoted anchor with n_estimators increased from 6000 to 7000 in both global and sub-models. Wide capacity-axis test before any local deepen/tune loop.
20260509-192702-deepen-v6_capacity_path	deepen	xgboost_v7	v6_capacity_path	46308.018576	5754.242728		1504.919118	keep	deepen_iter1_nest8000	Deepen iter1: after wide smoke selected the capacity lane, increase n_estimators from 7000 to 8000 in both global and top15 sub-models. Tests whether the v6/v7 capacity curve still has headroom before confirmation.
20260509-195253-deepen-v6_capacity_path	deepen	xgboost_v7	v6_capacity_path	47233.084429	3051.720894		1597.704833	confirm	confirm_iter1_seed2026	Stage 4 confirm seed=2026 of v7 iter1 (top15 per-type sub-models + n_est=8000). Verify the new raw global best before promotion.
20260509-212520-deepen-v6_capacity_path	deepen	xgboost_v7	v6_capacity_path	48273.935939	5075.167590		299.428617	keep	deepen_iter2_internal_early_stopping	Deepen iter2: on top of promoted v7 top15 plus n_est=8000, replace fixed 8000 trees with n_estimators=12000 and fold-internal early_stopping_rounds=200. The internal eval split is drawn only from each outer training split; the outer validation fold remains untouched.
