commit_or_run_id	stage	model_family	feature_lane	cv_mae	cv_mae_std	validation_mae	runtime_seconds	status	params_summary	description
20260508-224538-deepen-lane_a_extra_trees	deepen	tree_bagging_rf_v2	lane_a_extra_trees	52459.344644	5079.249908		174.520498	discard	single_knob=extra_trees	v2 Deepen iter3: ExtraTreesRegressor swap on lane A (built_rel_type). Same hyperparams (criterion=absolute_error, n_est=200, depth=18, mls=2, mf=0.4, bootstrap=False). Random splits trade some bias for less-correlated trees + variance reduction; might reach a noise-aware lift where features alone plateaued.
20260508-224945-deepen-lane_a_n_est_400	deepen	tree_bagging_rf_v2	lane_a_n_est_400	50660.718222	4806.290154		439.681842	discard	single_knob=n_est_400	v2 Deepen iter4: capacity bump n_est 200 -> 400 on lane A. v1 tune iter2 (n_est=500) was within noise but with depth=None; depth=18 + bagging=False trees are smaller and benefit from more averaging.
20260508-225821-deepen-lane_a_max_depth_22	deepen	tree_bagging_rf_v2	lane_a_max_depth_22	50908.386986	4766.490909		240.797308	discard	single_knob=max_depth_22	v2 Deepen iter5: max_depth 18 -> 22 on lane A. v1 ablate found depth=None harmful and depth=18 the sweet spot, but local search beyond 18 wasn't done. With built_rel_type now in the feature mix, a slightly deeper tree may capture missed type-x-size interactions.
20260508-230358-deepen-lane_a_mls_1	deepen	tree_bagging_rf_v2	lane_a_mls_1	50740.327767	4650.152996		233.318895	discard	single_knob=mls_1	v2 Deepen iter6: min_samples_leaf 2 -> 1 with depth=18 fixed. v1 tested mls=1 with depth=None and saw regression -- but with depth=18 cap, mls=1 may give finer terminal granularity without overfitting.
20260508-230947-deepen-lane_a_per_type_submodels	deepen	tree_bagging_rf_v2	lane_a_per_type_submodels	50602.362591	4808.996309		344.668102	discard	single_knob=per_type_submodels_top3	v2 Deepen iter7: per-property-type sub-model architecture on lane A. Train top-3 type sub-RFs (n_est=100, same recipe) on type subsets of train; blend 0.3*sub + 0.7*global for predictions of that type. xgboost_v4 saw -215 cumulative from this exact architecture. Top types: UNE MAISON (10085), UN APPARTEMENT (6443), TERRAIN DE TYPE TERRE ET PRE (2020).
20260508-232044-deepen-lane_a_log_skewed	deepen	tree_bagging_rf_v2	lane_a_log_skewed	50691.822254	4755.870678		362.916673	discard	single_knob=log_skewed_numerics	v2 Deepen iter8: add log1p of 9 heavily-skewed numeric columns (areas + count-of-X). Hypothesis: depth=18 trees may struggle to find split points in heavy-tailed distributions; explicit log transforms give RF easier-to-split linear-scaled features. Untried lift in this family.
20260508-232100-smoke-v4_plus_parcel_numeric	smoke	xgboost_v6	v4_plus_parcel_numeric	48219.945730	5176.027677		1554.509488	revert	smoke_laneB_v4_parcel_numeric_components	Smoke Lane B: v4 W''''' anchor + bounded numeric components parsed from first parcel_id (prefix code and parcel number). Tests whether within-section parcel positioning adds signal to the promoted v4 recipe without using raw high-cardinality IDs.
20260508-232800-deepen-lane_a_smooth_15	deepen	tree_bagging_rf_v2	lane_a_smooth_15	50767.984415	4851.364059		287.669044	discard	single_knob=smooth_15	v2 Deepen iter9: target_enc smooth 10 -> 15 on lane A. Mid-point between v1's tested 10 (winner) and 20 (baseline). With built_rel_type added in lane A, the optimal smoothing may have shifted slightly higher.
20260508-233359-deepen-lane_a_mf_0_3	deepen	tree_bagging_rf_v2	lane_a_mf_0_3	50886.083752	4890.892149		272.050118	discard	single_knob=mf_0_3	v2 Deepen iter10: max_features 0.4 -> 0.3 on lane A. v1 tested 0.5/0.7/sqrt + 0.4 won. Below 0.4 untested; more aggressive feature decorrelation between trees may help with the built_rel_type addition.
20260509-152129-deepen-lane_a_plus_built_rel_commune	deepen	tree_bagging_rf_v2	lane_a_plus_built_rel_commune	50676.005090	4791.533029		278.906587	discard	single_knob=built_rel_commune	v2 Deepen iter11: lane A + built_rel_commune = built_area / mean(built_area | commune_first), fold-safe. Different group than built_rel_type (commune ~196 vs property_type ~25); injects geographic-relative size signal.
20260508-234913-smoke-v4_plus_commune_section_cat	smoke	xgboost_v6	v4_plus_commune_section_cat	48512.356394	5012.684911		1476.221932	keep	smoke_laneC_commune_section_cat	Smoke Lane C: v4 W''''' anchor + combined commune_section categorical (commune_first + cadastral_first). Tests geo_granularity: section codes repeat across communes, so a nested combined category may preserve cadastral geography that separate native cats only approximate.
20260508-234913-smoke-v4_plus_commune_section_cat	smoke	xgboost_v6	v4_plus_commune_section_cat	48512.356394	5012.684911		1476.221932	revert	smoke_laneC_commune_section_cat	Smoke Lane C: v4 W''''' anchor + combined commune_section categorical (commune_first + cadastral_first). Tests geo_granularity: section codes repeat across communes, so a nested combined category may preserve cadastral geography that separate native cats only approximate.
20260509-161727-deepen-v4_anchor	deepen	xgboost_v6	v4_anchor	46946.756809	5238.026248		906.669483	keep	deepen_iter1_top15_submodels	Deepen iter1: extend per-type sub-models from promoted v4 top 5 types to top 15 types, keeping n_estimators=4000 and blend=0.3. v5 top10 gave a small lift; this tests whether additional type coverage continues that direction as one architecture knob.
20260509-165753-deepen-v4_anchor	deepen	xgboost_v6	v4_anchor	46879.264159	5285.137443		891.472251	keep	deepen_iter2_top15_nest5000	Deepen iter2: on top of iter1 (top15 per-type sub-models kept), increase n_estimators from 4000 to 5000 in both global and sub-models. v5's top10+n_est5000 step improved by ~69 MAE; repeating it on top15 may beat the raw global best.
20260509-171357-deepen-v4_anchor	deepen	xgboost_v6	v4_anchor	47252.542379	3268.159541		902.138699	confirm	confirm_iter2_seed2026	Stage 4 confirm seed=2026 of iter2 (top15 per-type sub-models + n_est=5000). Verify the new raw-best recipe against the prior v4/v5 confirmation baselines before promotion.
20260509-173002-deepen-v4_anchor	deepen	xgboost_v6	v4_anchor	46653.363174	5466.566178		1080.110452	keep	deepen_iter3_top15_nest6000	Deepen iter3: on top of iter2 (top15+n_est5000), increase n_estimators from 5000 to 6000 in both global and sub-models. Tests whether the capacity ramp still has headroom after the new raw-best iter2.
20260509-174840-deepen-v4_anchor	deepen	xgboost_v6	v4_anchor	47192.529246	3177.342838		1113.442358	confirm	confirm_iter3_seed2026	Stage 4 confirm seed=2026 of iter3 (top15 per-type sub-models + n_est=6000). Verify the new raw global best before promotion.
20260509-182620-smoke-v6_plus_top20_submodels	smoke	xgboost_v7	v6_plus_top20_submodels	47216.675236	5263.901533		1046.376802	revert	smoke_laneA_top20_submodels_min100	Smoke Lane A: v6 promoted anchor + extend per-type sub-models from top15/min200 to top20/min100. Wide architecture coverage test: determine whether remaining mid-frequency property types add specialized signal before local tuning.
20260509-184448-smoke-v6_blend02	smoke	xgboost_v7	v6_blend02	46726.018134	5530.229088		1055.034175	revert	smoke_laneB_blend02	Smoke Lane B: v6 promoted anchor with submodel BLEND lowered from 0.3 to 0.2. Wide architecture-weight test: v6 gained from more type coverage, but less submodel weight may reduce variance while keeping type-specific signal.
20260509-190305-smoke-v6_nest7000	smoke	xgboost_v7	v6_nest7000	46498.555473	5582.213215		1395.082747	keep	smoke_laneC_nest7000	Smoke Lane C: v6 promoted anchor with n_estimators increased from 6000 to 7000 in both global and sub-models. Wide capacity-axis test before any local deepen/tune loop.
20260509-192702-deepen-v6_capacity_path	deepen	xgboost_v7	v6_capacity_path	46308.018576	5754.242728		1504.919118	keep	deepen_iter1_nest8000	Deepen iter1: after wide smoke selected the capacity lane, increase n_estimators from 7000 to 8000 in both global and top15 sub-models. Tests whether the v6/v7 capacity curve still has headroom before confirmation.
20260509-195547-smoke-all_numeric	smoke	gradient_boosting_sklearn	all_numeric	57603.885927	5025.894986		28.587958	keep	GBR(loss=absolute_error,n_est=100,lr=0.1,max_depth=3,subsample=0.8),all_numeric,drop_id_and_geo_strings	Smoke lane A retry: sklearn GradientBoostingRegressor(loss=absolute_error, n_est=100, lr=0.1, max_depth=3, subsample=0.8) on all_numeric (37 cols after dropping region_code, parcel_ids, transferred_parcel_ids, commune_codes, cadastral_sections). Drops applied to fix prior float32 overflow precondition crash.
20260509-195905-smoke-numeric_plus_basic_cats	smoke	gradient_boosting_sklearn	numeric_plus_basic_cats	57111.240438	5119.164533		45.707888	keep	GBR(loss=absolute_error,n_est=100,lr=0.1,max_depth=3,subsample=0.8),numeric_plus_basic_cats,ohe(property_type+transaction_type)	Smoke lane B: lane-A anchor plus one-hot encoded property_type (25 cats) and transaction_type (6 cats). Tests whether low-cardinality property/transaction class signal lifts GBR over the numeric-only baseline. Single-knob: feature scope only; model hyperparameters unchanged.
20260509-200605-smoke-geo_signal	smoke	gradient_boosting_sklearn	geo_signal	55415.360986	4841.206199		31.177500	keep	GBR(loss=absolute_error,n_est=100,lr=0.1,max_depth=3,subsample=0.8),geo_signal,commune_te(k=20)	Smoke lane C: lane-A anchor plus one fold-safe smoothed mean-target encoding of commune_codes (~196 unique). Encoding fit only on each fold's training split (k=20 smoothing toward global train mean, global fallback for unseen communes). Single-knob: feature scope only; model hyperparameters unchanged.
20260509-195253-deepen-v6_capacity_path	deepen	xgboost_v7	v6_capacity_path	47233.084429	3051.720894		1597.704833	confirm	confirm_iter1_seed2026	Stage 4 confirm seed=2026 of v7 iter1 (top15 per-type sub-models + n_est=8000). Verify the new raw global best before promotion.
20260509-202125-deepen-geo_signal	deepen	gradient_boosting_sklearn	geo_signal	54102.890912	4723.246186		41.013232	keep	GBR(loss=absolute_error,n_est=100,lr=0.1,max_depth=4,subsample=0.8),geo_signal,commune_te(k=20)	Deepen iter3: max_depth 3 -> 4 on smoke geo_signal anchor. Tests interaction-depth bottleneck (vs iter2 capacity-count which tied). Single hyperparameter knob; n_estimators=100, lr=0.1, subsample=0.8 unchanged. If this also ties, capacity at this feature set is exhausted and iter4 should pivot to feature scope (cadastral TE or area_density_ratios).
20260509-203134-deepen-geo_signal	deepen	gradient_boosting_sklearn	geo_signal	53653.441447	4911.406514		51.902405	keep	GBR(loss=absolute_error,n_est=100,lr=0.1,max_depth=5,subsample=0.8),geo_signal,commune_te(k=20)	Deepen iter4: max_depth 4 -> 5 chained on iter3 (new family best 54102.89). Single hyperparameter knob. Tests whether depth keeps paying after the clear iter3 win. If this ties, depth is saturated and iter5 pivots to feature scope.
20260509-203703-deepen-geo_signal	deepen	gradient_boosting_sklearn	geo_signal	53941.167293	4741.888021		47.903010	keep	GBR(loss=absolute_error,n_est=100,lr=0.1,max_depth=4,subsample=0.8),geo_signal,commune_te(k=20)+cadastral_te(k=20)	Deepen iter5: anchor on iter3 (max_depth=4 family best). Add second fold-safe smoothed mean-target encoding column for cadastral_sections (846 unique, long-tail with 79% having <5 records). Single-knob: feature scope (+1 column). Same smoothing rule k=20. Hypothesis: section captures within-commune variation; smoothing handles the long tail.
20260509-203939-deepen-geo_signal	deepen	gradient_boosting_sklearn	geo_signal	54166.886764	4539.112586		47.226226	keep	GBR(loss=absolute_error,n_est=100,lr=0.1,max_depth=4,subsample=0.8),geo_signal,commune_te(k=20),area_density_ratios	Deepen iter6: anchor iter3 (max_depth=4 family best) + 3 size-normalized domain ratios as one hypothesis_unit -- built_area/num_premises, land_area/num_lots, num_commercial/num_premises (zero-safe via small-eps denominators). Single-knob (feature scope: 1 unit, 3 columns).
20260509-204222-deepen-geo_signal	deepen	gradient_boosting_sklearn	geo_signal	54165.883590	4705.712013		43.108214	keep	GBR(loss=absolute_error,n_est=100,lr=0.1,max_depth=4,subsample=0.8),geo_signal,commune_te(k=5)	Deepen iter7: smoothing-k 20 -> 5 on commune target encoding. Single preprocessing knob (smoothing constant). Same encoding strategy, fold-safety, and feature shape; only the k value changes.
20260509-204456-deepen-geo_signal	deepen	gradient_boosting_sklearn	geo_signal	54119.378407	4678.229598		89.941174	keep	GBR(loss=absolute_error,n_est=100,lr=0.1,max_depth=4,subsample=0.8),geo_signal,commune_te(k=20),log1p_areas	Deepen iter8: apply log1p to skewed area columns (land_area, built_area, house_area, apartment_area, all 10 area_apt_*_rooms / area_house_*_rooms). Single hypothesis_unit (log_skewed_numerics). Single preprocessing knob anchored on iter3. Hypothesis: tree splits on raw areas waste capacity on the long tail; log compression should make split thresholds carry more rows.
20260509-204818-deepen-geo_signal	deepen	gradient_boosting_sklearn	geo_signal	54315.854921	4777.648662		86.108760	keep	GBR(loss=absolute_error,n_est=100,lr=0.1,max_depth=4,min_samples_leaf=20,subsample=0.8),geo_signal,commune_te(k=20)	Deepen iter9: min_samples_leaf 1 -> 20 on iter3 anchor. Single hyperparameter knob. Hypothesis: enforces >=20 rows per leaf to reduce variance from small-leaf medians at max_depth=4.
20260509-205101-deepen-geo_signal	deepen	gradient_boosting_sklearn	geo_signal	54452.743379	4734.674797		93.749281	keep	GBR(loss=absolute_error,n_est=100,lr=0.1,max_depth=4,subsample=1.0),geo_signal,commune_te(k=20)	Deepen iter10: subsample 0.8 -> 1.0 on iter3 anchor (deterministic gradient, no per-stage row sampling). Single hyperparameter knob. Hypothesis: stochastic gradient may add noise that doesn't help on this 27k-row dataset; full-row gradient may stabilize the boosting trajectory.
20260509-210000-deepen-geo_signal	deepen	gradient_boosting_sklearn	geo_signal	55271.207146	5119.329172		39.003806	keep	GBR(loss=absolute_error,n_est=100,lr=0.1,max_depth=4,max_features=sqrt,subsample=0.8),geo_signal,commune_te(k=20)	Deepen iter11: max_features None -> 'sqrt' on iter3 anchor. Single hyperparameter knob (column subsampling per split). Hypothesis: sqrt(38)~6 features per split decorrelates trees, may reduce variance even though sklearn GBR is gradient (not bagging) -- useful in a per-stage stochastic model with subsample=0.8.
20260509-210203-deepen-geo_signal	deepen	gradient_boosting_sklearn	geo_signal	54179.964700	4365.604180		39.087640	keep	GBR(loss=absolute_error,n_est=100,lr=0.1,max_depth=4,subsample=0.8),geo_signal,commune_te(k=20),drop_room_layout	Deepen iter12: drop the 20 sparse room-layout columns (10 num_apt/house_*_rooms + 10 area_apt/house_*_rooms) on iter3 anchor. Each column is mostly 0 because rooms are gated by property_type. Single-knob (feature scope: drop unit). Hypothesis: removing sparse-zero columns reduces noise without losing signal that house_area / apartment_area / built_area already encode at the aggregate level.
20260509-210426-deepen-geo_signal	deepen	gradient_boosting_sklearn	geo_signal	53250.718821	4268.615067		101.377037	keep	GBR(loss=absolute_error,n_est=200,lr=0.1,max_depth=4,subsample=0.8),geo_signal,commune_te(k=20)	Deepen iter13: n_estimators 100 -> 200 alone on iter3 anchor (no lr change). Different from iter2's mechanically-paired bump. Single hyperparameter knob. Hypothesis: more boosting stages at the same step size may keep refining residuals; iter2's paired bump halved lr too aggressively.
20260509-210726-deepen-geo_signal	deepen	gradient_boosting_sklearn	geo_signal	53435.837619	3768.284309		159.258571	keep	GBR(loss=absolute_error,n_est=300,lr=0.1,max_depth=4,subsample=0.8),geo_signal,commune_te(k=20)	Deepen iter14: n_estimators 200 -> 300 chained on iter13 (n_est=200 mean+std win). Single hyperparameter knob. Hypothesis: if 200 trees lifted both mean and std, 300 may keep paying before overfitting; observe std as the key diagnostic.
20260509-211120-deepen-geo_signal	deepen	gradient_boosting_sklearn	geo_signal	53334.822822	4680.648982		200.084793	keep	GBR(loss=absolute_error,n_est=200,lr=0.1,max_depth=5,subsample=0.8),geo_signal,commune_te(k=20)	Deepen iter15: max_depth 4 -> 5 chained on iter13 (n_est=200 family best). Single hyperparameter knob. Hypothesis: iter4 (depth=5 on n_est=100) showed std rise; with n_est=200 the per-tree contribution is smaller (lr same, more stages) so depth=5 may now be better-behaved. Closes the user-requested upper-budget iter11-15.
20260509-212520-deepen-v6_capacity_path	deepen	xgboost_v7	v6_capacity_path	48273.935939	5075.167590		299.428617	keep	deepen_iter2_internal_early_stopping	Deepen iter2: on top of promoted v7 top15 plus n_est=8000, replace fixed 8000 trees with n_estimators=12000 and fold-internal early_stopping_rounds=200. The internal eval split is drawn only from each outer training split; the outer validation fold remains untouched.
20260509-214323-smoke-v7_plus_cadastral_counts	smoke	xgboost_v8	v7_plus_cadastral_counts	48468.888453	4727.278732		1083.617355	keep	smoke_laneA_add_cadastral_counts	Smoke laneA: extend numeric scope by adding 4 omitted cadastral counts (num_parcels, num_sections, num_communes, num_dependencies) on top of v7 promoted recipe. Single feature knob.
20260509-214332-smoke-v7_plus_room_density	smoke	xgboost_v8	v7_plus_room_density	48002.727808	5199.547985		756.335006	keep	smoke_laneB_room_area_density_ratios	Smoke laneB: add 10 avg-area-per-room ratios (apt+house x 5 buckets) on top of v7 promoted recipe. Single feature knob.
20260509-214336-smoke-v7_minus_sparse_rooms	smoke	xgboost_v8	v7_minus_sparse_rooms	48236.725737	5068.729435		641.066951	keep	smoke_laneC_drop_sparse_room_layout	Smoke laneC: drop 8 sparse 1-room/2-room layout columns from v7 promoted recipe. Single feature knob.
20260509-224734-deepen-v8_b_density_restored	deepen	xgboost_v8	v8_b_density_restored	48040.806878	5087.465593		1943.306104	keep	deepen_iter1_b_density_restored	Deepen iter1: restore capacity (n_est 4000->8000, top_k 10->15) on lane B (room_area_density_ratios) winner. Establishes restored-capacity reference for v8 deepen anchor.
20260509-232317-deepen-v8_drop_density	deepen	xgboost_v8	v8_drop_density	47978.894093	4784.971381		1488.138344	keep	deepen_iter2_drop_density	Deepen iter2: discard direction. DROP all 10 room_area_density_ratios from iter1's NUMERIC_COLUMNS. Single feature knob. Tests whether iter1's +1733 regression vs v7 promoted is attributable to those 10 columns. Also confirms v7-promoted reproducibility under v8 family pipeline.
20260509-235345-deepen-v8_drop_sparse_rooms	deepen	xgboost_v8	v8_drop_sparse_rooms	48461.879913	5025.829976		1247.034438	keep	deepen_iter3_drop_sparse_rooms	Deepen iter3: anchored on iter2 (v7-equivalent). DROP 8 sparse 1-room/2-room raw cols (num_apt_1_room, area_apt_1_room, num_apt_2_rooms, area_apt_2_rooms, num_house_1_room, area_house_1_room, num_house_2_rooms, area_house_2_rooms). Single feature knob.
20260510-004926-deepen-v8_drop_sparse_plus_cadastral	deepen	xgboost_v8	v8_drop_sparse_plus_cadastral	48492.171260	4846.088503		1285.130610	keep	deepen_iter4_add_cadastral	Deepen iter4: anchored on iter3 (drop sparse + no density). ADD num_parcels, num_sections, num_communes, num_dependencies. Single feature knob from iter3.
20260510-011240-deepen-v8_drop_const_cats	deepen	xgboost_v8	v8_drop_const_cats	48302.653328	5259.363435		1301.231541	keep	deepen_iter5_drop_const_cats	Deepen iter5: pivot back to family-best iter2 anchor. DROP dept_code and region_code from CATEGORICAL_COLUMNS (CLAUDE.md flags both as constant in training; they only add encoding overhead with no decision splits).
20260510-013543-deepen-v8_log_skewed	deepen	xgboost_v8	v8_log_skewed	47978.894093	4784.971381		1301.697872	keep	deepen_iter6_log_skewed	Deepen iter6: anchored on family-best iter2. Replace built_area, land_area, house_area, apartment_area with their log1p variants in NUMERIC_COLUMNS. Single preprocessing knob. Tests whether log spacing maps long-tailed area distributions onto more uniform hist-bin density.
20260510-015847-deepen-v8_presence_flags	deepen	xgboost_v8	v8_presence_flags	47963.501368	4952.186361		1323.437211	keep	deepen_iter7_presence_flags	Deepen iter7: anchored on iter6 (=iter2). ADD 5 binary presence flags (has_apartments, has_houses, has_commercial, has_dependencies, has_lots). Single feature knob.
20260510-022205-deepen-v8_parcel_ratios	deepen	xgboost_v8	v8_parcel_ratios	48718.819469	4639.179798		1357.190592	keep	deepen_iter8_parcel_ratios	Deepen iter8: anchored on iter7. ADD 4 cadastral density ratios (parcels_per_section, parcels_per_commune, sections_per_commune, lots_per_parcel). Single feature knob.
20260510-024610-deepen-v8_month_cyclical	deepen	xgboost_v8	v8_month_cyclical	48549.826585	5070.479724		1377.104313	keep	deepen_iter9_month_cyclical	Deepen iter9: anchored on iter7 (family-best). ADD sin_month and cos_month cyclical encoding. Single feature knob.
20260510-031025-deepen-v8_iter7_minus_sparse	deepen	xgboost_v8	v8_iter7_minus_sparse	48329.382386	5140.846300		1261.838098	keep	deepen_iter10_compose_drop_sparse	Deepen iter10: anchored on iter7 (family-best). DROP 8 sparse 1-room/2-room raw cols. Single feature knob. Closes deepen at min=10.
20260510-033345-tune-v8_tune_iter1_lr_003	tune	xgboost_v8	v8_tune_iter1_lr_003	48454.124386	4999.009626		600.075704	keep	tune_iter1_lr_003	Tune iter1: smoke-shrink anchor (iter7 recipe at n_est=4000, top_k=10). Single hyperparameter knob: learning_rate 0.05 -> 0.03.
20260510-034439-tune-v8_tune_iter2_lr_007	tune	xgboost_v8	v8_tune_iter2_lr_007	47875.822992	5165.775046		589.189953	keep	tune_iter2_lr_007	Tune: tune_iter2_lr_007 on iter7 recipe at smoke-shrink (n_est=4000, top_k=10).
