commit_or_run_id	stage	model_family	feature_lane	cv_mae	cv_mae_std	validation_mae	runtime_seconds	status	params_summary	description
20260507-214129-ablate-baseline_three_only	ablate	xgboost_v3	baseline_three_only	62689.656963	4456.985345		34.576040	ablate	ablate_a1_revert_max_depth	Ablate a1: revert max_depth to default 6 (keep colsample=1.0). Test whether max_depth=2 was load-bearing vs W'''.
20260507-214312-ablate-baseline_three_only	ablate	xgboost_v3	baseline_three_only	62626.240945	4390.195212		30.975452	ablate	ablate_a2_revert_colsample	Ablate a2: revert colsample_bytree to default 0.8 (keep max_depth=2). Test whether colsample=1.0 was load-bearing vs W'''.
20260507-214500-confirm-baseline_three_only	confirm	xgboost_v3	baseline_three_only	62674.079203	4330.881819		26.216054	confirm	confirm_seed2026	Stage 4 confirm seed=2026 of W''' (deepen iter9 winner: max_depth=2 + colsample=1.0). Verify seed agreement before promotion.
20260507-215240-smoke-v2_plus_geo_hierarchy	smoke	xgboost_v4	v2_plus_geo_hierarchy	49111.528480	4975.370854		43.246474	keep	smoke_laneA_dept_region_cats	Smoke Lane A: v2 base + dept_code (native cat) + region_code (native cat). Tests whether geographic hierarchy above commune adds signal not captured by commune_first cat alone.
20260507-215422-smoke-v2_plus_temporal_cats	smoke	xgboost_v4	v2_plus_temporal_cats	49343.363937	4921.882504		40.721233	revert	smoke_laneB_temporal_cats	Smoke Lane B: v2 base + year (native cat) + month (native cat) + future_sale (numeric). Tests temporal granularity beyond date_ordinal.
20260507-215605-smoke-v2_plus_fold_te	smoke	xgboost_v4	v2_plus_fold_te	49505.392063	4921.569910		37.687597	revert	smoke_laneC_fold_te30	Smoke Lane C: v2 base + fold-safe target encoding on commune_first (smooth=30). TE computed on train fold only, applied to validation. Adds smoothed mean(log1p(value)) signal beyond native cat encoding.
20260507-215826-deepen-v2_plus_geo_hierarchy	deepen	xgboost_v4	v2_plus_geo_hierarchy	49173.361116	4989.365311		39.644306	revert	deepen_iter1_geo_counts	Deepen iter1: add num_communes, num_sections, num_parcels (geographic granularity counts). Single idea: properties spanning multiple geographic units may have different value distributions.
20260507-220033-deepen-v2_plus_geo_hierarchy	deepen	xgboost_v4	v2_plus_geo_hierarchy	49354.933769	4778.189698		39.831908	revert	deepen_iter2_dept_te20	Deepen iter2: add fold-safe dept-level TE (smooth=20). 96 dept levels = much more reliable than 36k commune levels; commune TE failed but dept TE may aggregate signal at the right granularity.
20260507-220239-deepen-v2_plus_geo_hierarchy	deepen	xgboost_v4	v2_plus_geo_hierarchy	48995.706307	4856.334854		38.314732	keep	deepen_iter3_built_per_land	Deepen iter3: add built_per_land = built_area/land_area (terrain density). Trees struggle with explicit ratios; this captures urban-vs-rural density even when both inputs are present.
20260507-220411-deepen-v2_plus_geo_hierarchy	deepen	xgboost_v4	v2_plus_geo_hierarchy	49002.776662	5037.333168		44.472241	revert	deepen_iter4_total_rooms	Deepen iter4: add total_rooms = sum of all num_*_rooms columns. Different size proxy than area features.
20260507-220558-deepen-v2_plus_geo_hierarchy	deepen	xgboost_v4	v2_plus_geo_hierarchy	48750.972819	5086.090839		39.607682	keep	deepen_iter5_built_rel_type	Deepen iter5: add fold-safe built_rel_type = built_area / mean(built_area|property_type) computed from train. Measures property size relative to type norm.
20260507-220755-deepen-v2_plus_geo_hierarchy	deepen	xgboost_v4	v2_plus_geo_hierarchy	49242.500350	4916.367988		38.881375	revert	deepen_iter6_built_rel_commune	Deepen iter6: add fold-safe built_rel_commune = built_area / mean(built_area|commune_first). Measures size relative to local market norm.
20260507-220939-deepen-v2_plus_geo_hierarchy	deepen	xgboost_v4	v2_plus_geo_hierarchy	49390.119340	4909.160864		37.881932	revert	deepen_iter7_built_rel_dept	Deepen iter7: add fold-safe built_rel_dept = built_area / mean(built_area|dept_code). 96 dept levels means more reliable group means than commune-level.
20260507-221123-deepen-v2_plus_geo_hierarchy	deepen	xgboost_v4	v2_plus_geo_hierarchy	49111.687895	4922.482745		42.974610	revert	deepen_iter8_land_rel_type	Deepen iter8: add fold-safe land_rel_type = land_area / mean(land_area|property_type). Analogous to iter5 winner but for land area.
20260507-221317-deepen-v2_plus_geo_hierarchy	deepen	xgboost_v4	v2_plus_geo_hierarchy	49208.416857	4914.076429		38.557882	revert	deepen_iter9_proptype_te20	Deepen iter9: add fold-safe TE on property_type (smooth=20). Low cardinality (~10 types) gives stable means; trees can use the continuous TE complementarily to the cat.
20260507-221501-deepen-v2_plus_geo_hierarchy	deepen	xgboost_v4	v2_plus_geo_hierarchy	49181.916910	5115.375393		36.975767	revert	deepen_iter10_drop_geo_hierarchy	Deepen iter10: drop dept_code and region_code native cats. Test whether they're load-bearing in W''.
20260507-221635-deepen-v2_plus_geo_hierarchy	deepen	xgboost_v4	v2_plus_geo_hierarchy	49355.507787	4997.755469		45.389447	revert	deepen_iter11_house_rel_type	Deepen iter11: add fold-safe house_area_rel_type = house_area / mean(house_area|property_type). Replicate iter5 winner pattern for second-most-important area feature.
20260507-221832-deepen-v2_plus_geo_hierarchy	deepen	xgboost_v4	v2_plus_geo_hierarchy	48682.665867	4964.278827		103.533936	revert	deepen_iter12_ensemble_3seeds	Deepen iter12: predict by averaging 3 XGBoost models with seeds 42, 100, 200. Variance reduction often gives consistent small lift orthogonal to feature engineering.
20260507-222114-deepen-v2_plus_geo_hierarchy	deepen	xgboost_v4	v2_plus_geo_hierarchy	48782.978998	5086.373793		49.572650	revert	deepen_iter13_max_depth_8	Deepen iter13: max_depth=8 (vs 6). v4 has more features than v2; deeper trees may catch new interactions.
20260507-222309-deepen-v2_plus_geo_hierarchy	deepen	xgboost_v4	v2_plus_geo_hierarchy	48895.985933	4834.686555		74.098658	revert	deepen_iter14_blend_log_raw	Deepen iter14: predict by averaging log-target and raw-target XGBoost predictions (50/50). Different target scales = different residual structures, often additive lift.
20260507-222526-deepen-v2_plus_geo_hierarchy	deepen	xgboost_v4	v2_plus_geo_hierarchy	49313.351505	4960.001018		39.841194	revert	deepen_iter15_type_mean_built	Deepen iter15: add type_mean_built = mean(built_area | property_type) per row, fold-safe. Direct group-stat (not ratio) telling model the typical built_area for the type.
20260507-222706-deepen-v2_plus_geo_hierarchy	deepen	xgboost_v4	v2_plus_geo_hierarchy	48939.338358	5110.865558		70.467468	revert	deepen_iter16_lr03_nest1000	Deepen iter16 (tune): lr=0.03 + n_est=1000. Slower learning, more iterations may extract more signal from current feature set.
20260507-222934-deepen-v2_plus_geo_hierarchy	deepen	xgboost_v4	v2_plus_geo_hierarchy	49406.929137	5336.266224		52.270174	revert	deepen_iter17_early_stopping	Deepen iter17: train with internal 90/10 train/eval split + early_stopping_rounds=30 + n_est=2000. Picks optimal stopping point per fold.
20260507-223141-deepen-v2_plus_geo_hierarchy	deepen	xgboost_v4	v2_plus_geo_hierarchy	48930.975522	5077.527711		540.919962	revert	deepen_iter18_hetero_ensemble_5	Deepen iter18: 5-model heterogeneous ensemble averaging (vary max_depth, lr, subsample). Greater diversity than seed averaging.
20260507-224237-deepen-v2_plus_geo_hierarchy	deepen	xgboost_v4	v2_plus_geo_hierarchy	88130.680125	6568.899178		864.625952	revert	deepen_iter19_ridge_residual	Deepen iter19: stack Ridge regression on XGB residuals. Captures linear patterns the boosted trees miss.
20260507-225841-deepen-v2_plus_geo_hierarchy	deepen	xgboost_v4	v2_plus_geo_hierarchy	50596.765581	4870.511787		39.213812	revert	deepen_iter20_drop_cadastral_first	Deepen iter20: drop cadastral_first cat. Cad sections nest within communes; may be redundant with commune_first cat.
20260507-230116-deepen-v2_plus_geo_hierarchy	deepen	xgboost_v4	v2_plus_geo_hierarchy	49027.332643	4998.185259		42.904158	revert	deepen_iter21_te_type_x_dept	Deepen iter21: 2D TE on (property_type, dept_code) with smoothing=30. Captures type-specific regional pricing differences.
20260507-230310-deepen-v2_plus_geo_hierarchy	deepen	xgboost_v4	v2_plus_geo_hierarchy	48597.973703	5091.152470		92.100680	keep	deepen_iter22_per_type_submodels	Deepen iter22: train global + 2 per-type sub-models (UNE MAISON, UN APPARTEMENT). Predict global. For MAISON/APPARTEMENT rows, blend 0.5 global + 0.5 sub-model. Type-specific specialization.
20260507-230547-deepen-v2_plus_geo_hierarchy	deepen	xgboost_v4	v2_plus_geo_hierarchy	48540.949484	4913.946593		95.345486	keep	deepen_iter23_5_submodels	Deepen iter23: extend per-type sub-models to top 5 types: UNE MAISON, UN APPARTEMENT, TERRAIN DE TYPE TERRE ET PRE, TERRAIN DE TYPE TAB, ACTIVITE. Same 0.5 blend.
20260507-230822-deepen-v2_plus_geo_hierarchy	deepen	xgboost_v4	v2_plus_geo_hierarchy	48688.690972	4807.351594		471.075273	revert	deepen_iter24_blend_0p7	Deepen iter24: blend ratio 0.7 sub / 0.3 global (vs 0.5/0.5). Sub-models may have stronger type signal than global.
20260507-231709-deepen-v2_plus_geo_hierarchy	deepen	xgboost_v4	v2_plus_geo_hierarchy	48535.541681	5006.717387		88.112525	keep	deepen_iter25_blend_0p3	Deepen iter25: blend ratio 0.3 sub / 0.7 global. Less sub-model influence; global may be more reliable for type-specific patterns it already learned.
20260507-231946-deepen-v2_plus_geo_hierarchy	deepen	xgboost_v4	v2_plus_geo_hierarchy	48620.860177	5051.862655		76.765428	revert	deepen_iter26_submodel_depth4	Deepen iter26: sub-models trained with max_depth=4 (vs global's 6). Smaller per-type datasets benefit from more regularization.
20260507-232225-deepen-v2_plus_geo_hierarchy	deepen	xgboost_v4	v2_plus_geo_hierarchy	48525.514024	4695.468114		82.099983	revert	deepen_iter27_per_type_residual	Deepen iter27: per-type sub-models trained on RESIDUALS (target - global_pred) instead of raw target. Final pred = global + sub_residual.
20260507-232514-deepen-v2_plus_geo_hierarchy	deepen	xgboost_v4	v2_plus_geo_hierarchy	48549.605674	5165.498167		43.245491	revert	deepen_iter28_per_type_log_residual	Deepen iter28: per-type sub-models train on log-residuals (log_y - log_pred_global). Combine target skewness handling with stacking.
20260507-232717-deepen-v2_plus_geo_hierarchy	deepen	xgboost_v4	v2_plus_geo_hierarchy	48589.689706	4995.365757		55.983584	revert	deepen_iter29_submodel_nest300	Deepen iter29: sub-models with n_est=300 (vs global's 500). Smaller per-type datasets need less capacity.
20260507-232950-deepen-v2_plus_geo_hierarchy	deepen	xgboost_v4	v2_plus_geo_hierarchy	48528.179025	5131.481286		65.327167	revert	deepen_iter30_gamma_1	Deepen iter30: gamma=1.0 (vs default 0). Min split gain regularization. Untested in v2 search.
20260507-233219-deepen-v2_plus_geo_hierarchy	deepen	xgboost_v4	v2_plus_geo_hierarchy	48944.524949	4953.788718		62.445266	revert	deepen_iter31_drop_room_layout	Deepen iter31: drop num_/area_*_rooms (18 sparse cols). May reduce noise.
20260507-233426-deepen-v2_plus_geo_hierarchy	deepen	xgboost_v4	v2_plus_geo_hierarchy	49183.367598	5021.600619		173.206043	revert	deepen_iter32_global_5bag	Deepen iter32: replace global with average of 5 XGB models on bootstrap samples (with replacement). Per-type sub-models stay same. Bootstrap diversity > seed diversity.
20260507-233814-deepen-v2_plus_geo_hierarchy	deepen	xgboost_v4	v2_plus_geo_hierarchy	48053.743013	5046.996985		108.311272	keep	deepen_iter33_nest_1000	Deepen iter33: n_estimators=1000 (vs 500), keep lr=0.05. More trees may extract more signal.
20260507-234057-deepen-v2_plus_geo_hierarchy	deepen	xgboost_v4	v2_plus_geo_hierarchy	47770.070360	5050.264853		161.996931	keep	deepen_iter34_nest_1500	Deepen iter34: n_estimators=1500 (vs 1000). More trees, see if lift continues.
20260507-234432-deepen-v2_plus_geo_hierarchy	deepen	xgboost_v4	v2_plus_geo_hierarchy	47535.233987	5103.906677		255.458429	keep	deepen_iter35_nest_2000	Deepen iter35: n_estimators=2000 (vs 1500). Continue exploring capacity ceiling.
20260507-234936-deepen-v2_plus_geo_hierarchy	deepen	xgboost_v4	v2_plus_geo_hierarchy	47408.982923	5170.389096		377.736420	keep	deepen_iter36_nest_3000	Deepen iter36: n_estimators=3000. Push trees further if lift continues.
20260507-235645-deepen-v2_plus_geo_hierarchy	deepen	xgboost_v4	v2_plus_geo_hierarchy	47107.532662	5244.674556		459.269720	keep	deepen_iter37_nest_4000	Deepen iter37: n_estimators=4000. Test if returns continue diminishing.
20260508-000514-deepen-v2_plus_geo_hierarchy	deepen	xgboost_v4	v2_plus_geo_hierarchy	47041.545184	5297.923104		572.104935	revert	deepen_iter38_nest_5000	Deepen iter38: n_estimators=5000. Push capacity ceiling further.
20260508-001554-deepen-v2_plus_geo_hierarchy	deepen	xgboost_v4	v2_plus_geo_hierarchy	48228.970189	5084.448930		405.465023	revert	deepen_iter39_lr03_nest4000	Deepen iter39: lr=0.03 + n_est=4000. Slower learning may extract more signal at fixed tree budget.
20260508-002406-deepen-v2_plus_geo_hierarchy	deepen	xgboost_v4	v2_plus_geo_hierarchy	48381.678540	4867.085244		516.554208	revert	deepen_iter40_depth_8	Deepen iter40: max_depth=8 with n_est=4000. Test depth at higher tree count.
20260508-002700-ablate-v2_plus_geo_hierarchy	ablate	xgboost_v4	v2_plus_geo_hierarchy	47392.216155	5328.153531		176.253566	ablate	ablate_a1_drop_submodels	Ablate a1: drop per-type sub-models (no SUB_TYPES). Test if the per-type architecture is load-bearing in W'''''.
20260508-003012-confirm-v2_plus_geo_hierarchy	confirm	xgboost_v4	v2_plus_geo_hierarchy	47998.491092	3831.880958		408.434188	confirm	confirm_seed2026	Stage 4 confirm seed=2026 of W''''' (iter37 winner: per-type sub-models + n_est=4000 + all kept knobs). Validate seed agreement before promotion.
20260508-122416-smoke-v4_plus_presence_flags	smoke	xgboost_v5	v4_plus_presence_flags	48299.246023	5011.589350		1557.545350	revert	smoke_laneA_presence_flags	Smoke Lane A: v4 W''''' base + presence flags (binary is_present indicators) for top-importance numeric fields (built_area, house_area, land_area, apartment_area, num_premises, num_houses, num_apartments). Tests whether missingness PATTERN carries signal beyond xgboost's native missing handling.
20260508-122419-smoke-v4_plus_id_token_counts	smoke	xgboost_v5	v4_plus_id_token_counts	48801.898669	4890.915783		701.798609	revert	smoke_laneB_id_token_counts	Smoke Lane B: v4 W''''' base + bounded-derived id token counts: num_parcel_ids = count(comma tokens in parcel_ids) and num_transferred_parcel_ids. Captures transaction scale/complexity orthogonal to area features. No raw IDs used.
20260508-122421-smoke-v4_plus_commune_frequency	smoke	xgboost_v5	v4_plus_commune_frequency	48336.922406	4934.642996		700.482693	revert	smoke_laneC_commune_frequency	Smoke Lane C: v4 W''''' base + commune_first_freq (fold-safe count of commune_first level in train fold). Distinct from commune-level TE (which failed Lane C in v4 due to noisy 36k means) — frequency signal measures market liquidity, not mean price. Trees can use it to weight reliability of cat-derived signals.
20260508-141116-deepen-v4_anchor	deepen	xgboost_v5	v4_anchor	48411.821346	4947.956569		720.544507	revert	deepen_iter4_cadastral_te20	Deepen iter4: add fold-safe cadastral_first TE smooth=20 to v4 anchor. Section level (846 levels) is the untested middle ground between commune (36k means failed, v4 Lane C) and dept (96 means tied, v4 iter2). Best chance for TE to clear noise at this cardinality.
20260508-142447-deepen-v4_anchor	deepen	xgboost_v5	v4_anchor	47568.604252	5023.382961		1984.793212	revert	deepen_iter5_3seeds	Deepen iter5: 3-seed averaging on v4 anchor. Replace single-seed predict with mean of seeds {42, 100, 200} for both global and per-type sub-models. Variance reduction. Distinct from v4 iter12 (3-seed at n_est=500); v5 anchor n_est=4000 has cv_mae_std ~5244 (vs v4 iter11 std ~4922), so seed effect may now exceed noise band.
20260508-150002-deepen-v4_anchor	deepen	xgboost_v5	v4_anchor	47392.216158	5328.153506		538.032160	revert	deepen_iter6_per_region_submodels	Deepen iter6: replace per-type sub-models with per-region sub-models (top 5 regions by sample count). Tests whether geographic specialization captures more signal than property-type specialization. Same cost as anchor (still 6 model fits per fold).
20260508-151054-deepen-v4_anchor	deepen	xgboost_v5	v4_anchor	47135.836219	5213.640946		746.319362	revert	deepen_iter7_submodel_depth8	Deepen iter7: per-type sub-models trained with max_depth=8 (vs global's max_depth=6). Sub-models see smaller per-type slices; v4 iter26 tested smaller sub-model depth=4 and tied. Untested direction is BIGGER sub-model capacity to capture richer type-specific interactions.
20260508-152527-deepen-v4_anchor	deepen	xgboost_v5	v4_anchor	48028.873092	5050.229983		1022.492127	revert	deepen_iter8_hgb_blend50	Deepen iter8: blend v4 anchor predictions 50/50 with HistGradientBoostingRegressor(absolute_error). Tests cross-family model diversity -- HGB and XGB have different histogramming and split criteria. v4 iter18 heterogeneous-XGB ensemble failed at n_est=500; this is cross-family blend at v4 capacity.
20260508-154428-deepen-v4_anchor	deepen	xgboost_v5	v4_anchor	46978.021083	5246.892228		810.250494	keep	deepen_iter9_top10_submodels	Deepen iter9: extend per-type sub-models from top 5 to top 10 types. v4 iter23 extended from 2 to 5 (-57 lift); the next-tier types may have enough samples to add similar marginal lift even though smaller.
20260508-160016-deepen-v4_anchor	deepen	xgboost_v5	v4_anchor	46909.141746	5296.853264		1158.000829	keep	deepen_iter10_top10_nest5000	Deepen iter10: ON TOP OF iter9 (top-10 sub-models, KEPT), bump n_estimators 4000->5000 in BOTH global and sub-models. v4 iter38 tested n_est=5000 alone (-66 lift, within noise); compounding with iter9's -130 may clear noise band cumulatively.
20260508-162111-deepen-v4_anchor	deepen	xgboost_v5	v4_anchor	48380.323907	4872.035552		1413.894539	revert	deepen_iter11_lr04_nest6250	Deepen iter11: ON TOP OF iter10 (top10 sub-models + n_est=5000 KEPT), test mechanically-paired knob lr=0.04 + n_est=6250 (lr*n_est=250 same step budget as iter10's 0.05*5000=250). Slower learning at fixed step budget often extracts more signal.
20260508-164635-deepen-v4_anchor	deepen	xgboost_v5	v4_anchor	47030.071357	5187.331242		1452.507252	revert	deepen_iter12_blend04	Deepen iter12: ON TOP OF iter10 (top10 + n_est=5000 KEPT), change BLEND ratio 0.3 -> 0.4 for sub-model contribution. v4 ablate showed sub-models contribute marginally (+285 when dropped); raising blend weight tests whether more sub-model influence helps now that there are 10 sub-models (vs v4's top 5). Single knob.
20260508-171239-deepen-v4_anchor	deepen	xgboost_v5	v4_anchor	47933.364028	5012.294173		962.190539	revert	deepen_iter13_subsample07	Deepen iter13: ON TOP OF iter10 (top10 + n_est=5000), test subsample 0.8 -> 0.7 (single knob). Untested in xgboost_v4 chain. Lower subsample = more variance per tree = potentially better generalization in saturated capacity regime.
20260508-173019-deepen-v4_anchor	deepen	xgboost_v5	v4_anchor	47790.959639	3596.403635		1072.605677	confirm	confirm_iter10_seed2026	Stage 4 confirm seed=2026 of iter10 (top10 sub-models + n_est=5000 on v4 anchor). Two-seed agreement check before any global-champion claim.
20260508-221818-smoke-v5_plus_parcel_numeric	smoke	xgboost_v6	v5_plus_parcel_numeric				3600.092455	timeout	smoke_laneA_parcel_numeric_components	Smoke Lane A: v5 iter10 anchor + bounded numeric components parsed from first parcel_id (prefix code and parcel number). Train-only inspection found structured cadastral IDs; tests whether within-section parcel positioning carries signal beyond commune_first/cadastral_first cats without using raw high-cardinality IDs.
20260508-222002-smoke-v1_anchor_plus_built_rel_type	smoke	tree_bagging_rf_v2	v1_anchor_plus_built_rel_type	50565.974406	4813.843906		222.442429	keep	single_knob=built_rel_type	v2 Smoke lane A: v1 promoted recipe + fold-safe built_rel_type = built_area / mean(built_area | property_type). Anchor = v1 promoted recipe (50663.64 seed=42). xgboost_v4 saw -245 from this exact unit.
20260508-222453-smoke-v1_anchor_plus_id_token_counts	smoke	tree_bagging_rf_v2	v1_anchor_plus_id_token_counts	50824.037567	4823.656796		234.957531	keep	single_knob=id_token_counts	v2 Smoke lane B: v1 promoted recipe + parcel_id_count and transferred_parcel_id_count (comma-split lengths). Anchor v1 (50663.64). Hypothesis: ID tokens encode multi-parcel structure; bounded counts dodge the high-cardinality leakage warning in feature_search_space.md.
20260508-223005-smoke-v1_anchor_plus_room_density	smoke	tree_bagging_rf_v2	v1_anchor_plus_room_density	50575.663556	4719.439859		245.749993	keep	single_knob=room_area_density_ratios	v2 Smoke lane C: v1 promoted recipe + 10 room density ratios (area_*/num_* per apt/house room bucket). Anchor v1 (50663.64). Hypothesis: per-room area is a per-dwelling size signal that aggregate built_area misses; protected against zero-num denominators.
20260508-223520-deepen-lane_a_plus_built_per_land	deepen	tree_bagging_rf_v2	lane_a_plus_built_per_land	50941.892490	4770.091493		228.306668	discard	single_knob=built_per_land	v2 Deepen iter1: lane A best (built_rel_type) + built_per_land = built_area/land_area cumulative. xgboost_v4 saw -116 from this exact unit.
20260508-224002-deepen-lane_a_plus_room_density	deepen	tree_bagging_rf_v2	lane_a_plus_room_density	50705.800985	4712.801637		256.748008	discard	single_knob=room_density_cumulative	v2 Deepen iter2: lane A (built_rel_type) + room_area_density_ratios cumulative. Lane C alone showed -88 vs anchor; cumulative may push -180 if the two signals are non-redundant.
